{
  "$schema": "https://raw.githubusercontent.com/mitsuhiko/pi-ds4/main/settings.schema.json",
  "protocol": "openai",
  "apiKey": "dsv4-local",
  "supportRepo": "https://github.com/antirez/ds4",
  "supportBranch": "main",
  "runtimeDir": null,
  "modelQuant": null,
  "readyTimeoutMs": 600000,
  "serverBinary": null,
  "watchdogScript": null
}
